{
  "schemaVersion": 1,
  "suiteVersion": "1.1",
  "startedUtc": "2026-10-21T15:25:13.8692525+00:00",
  "runtime": ".NET 8.0.32",
  "operatingSystem": "Microsoft Windows 10.0.26300",
  "architecture": "X64",
  "server": "apache",
  "serverVersion": "2.4.65",
  "serverVersionSource": "fixture-pin-or-operator-label",
  "authentication": "basic",
  "transport": "http",
  "loopback": true,
  "sourceRevision": "b3e2e5e80e38876767ac9e82c3a9bdca01e4e5b4",
  "sourceRevisionScope": "repository revision at execution; result-only commit may follow",
  "runTree": "webdavclient-interop-d4324786a0c74075a2bcbb1e4c05faac",
  "advertisedDav": [
    "1",
    "2",
    "\u003Chttp://apache.org/dav/propset/fs/1\u003E"
  ],
  "advertisedMethods": [
    "OPTIONS",
    "GET",
    "HEAD",
    "POST",
    "DELETE",
    "TRACE",
    "PROPFIND",
    "PROPPATCH",
    "COPY",
    "MOVE",
    "LOCK",
    "UNLOCK"
  ],
  "advertisedReports": [],
  "observations": [
    {
      "operation": "options",
      "outcome": "passed",
      "httpStatus": 200,
      "memberStatuses": [],
      "propertyStatuses": []
    },
    {
      "operation": "isolation-preflight",
      "outcome": "passed",
      "httpStatus": 404,
      "detail": "Expected HTTP 404"
    },
    {
      "operation": "create-tree",
      "outcome": "passed",
      "httpStatus": 201,
      "memberStatuses": [],
      "propertyStatuses": []
    },
    {
      "operation": "unicode-put",
      "outcome": "passed",
      "httpStatus": 201,
      "memberStatuses": [],
      "propertyStatuses": []
    },
    {
      "operation": "authentication-boundary",
      "outcome": "passed",
      "httpStatus": 401,
      "detail": "Unauthenticated HEAD must be 401 with the configured authentication scheme; no bad-password attempts."
    },
    {
      "operation": "unicode-get",
      "outcome": "passed",
      "httpStatus": 200,
      "detail": "Byte-for-byte body and range metadata checked."
    },
    {
      "operation": "head-metadata",
      "outcome": "passed",
      "httpStatus": 200,
      "memberStatuses": [],
      "propertyStatuses": []
    },
    {
      "operation": "range-get",
      "outcome": "passed",
      "httpStatus": 206,
      "detail": "Byte-for-byte body and range metadata checked."
    },
    {
      "operation": "conditional-create",
      "outcome": "failed",
      "detail": "weak-etag"
    },
    {
      "operation": "conditional-put",
      "outcome": "blocked",
      "detail": "Guarded creation, bytes and strong validator were not confirmed."
    },
    {
      "operation": "conditional-integrity",
      "outcome": "blocked",
      "detail": "No confirmed guarded-write baseline."
    },
    {
      "operation": "conditional-etag-create",
      "outcome": "failed",
      "detail": "weak-etag"
    },
    {
      "operation": "conditional-if-match",
      "outcome": "blocked",
      "detail": "No confirmed strong-validator baseline."
    },
    {
      "operation": "conditional-if-match-integrity",
      "outcome": "blocked",
      "detail": "Matching-validator replacement was not confirmed."
    },
    {
      "operation": "conditional-stale-put",
      "outcome": "blocked",
      "detail": "No confirmed replacement with a new strong validator."
    },
    {
      "operation": "conditional-stale-integrity",
      "outcome": "blocked",
      "detail": "No confirmed stale-validator baseline."
    },
    {
      "operation": "propfind-statuses",
      "outcome": "passed",
      "httpStatus": 207,
      "memberStatuses": [],
      "propertyStatuses": [
        200,
        404
      ],
      "detail": "Requested missing property must be 404 beside valid content length."
    },
    {
      "operation": "streamed-listing",
      "outcome": "passed",
      "httpStatus": 207,
      "memberStatuses": [],
      "propertyStatuses": [
        200,
        200,
        200,
        200
      ],
      "detail": "Full enumeration, document completion, member/property success, and Unicode child href checked."
    },
    {
      "operation": "dead-property",
      "outcome": "passed",
      "httpStatus": 207,
      "memberStatuses": [],
      "propertyStatuses": [
        200
      ],
      "detail": "Set custom property and read exact value back. Explicit Apache path-only plus/%2B target-alias opt-in; strict default identity is unchanged."
    },
    {
      "operation": "lock-unlock",
      "outcome": "passed",
      "httpStatus": 200,
      "memberStatuses": [],
      "propertyStatuses": [],
      "detail": "Exclusive lock, conflicting DELETE=423, refresh, UNLOCK confirmed."
    },
    {
      "operation": "lock-put-create",
      "outcome": "failed",
      "detail": "weak-etag"
    },
    {
      "operation": "lock-put-valid",
      "outcome": "blocked",
      "detail": "No confirmed run-owned resource/validator for lock-conditioned mutations."
    },
    {
      "operation": "lock-delete-create",
      "outcome": "failed",
      "detail": "weak-etag"
    },
    {
      "operation": "lock-delete-valid",
      "outcome": "blocked",
      "detail": "No confirmed run-owned resource/validator for lock-conditioned mutations."
    },
    {
      "operation": "lock-move-create",
      "outcome": "failed",
      "detail": "weak-etag"
    },
    {
      "operation": "lock-move-valid",
      "outcome": "blocked",
      "detail": "No confirmed run-owned resource/validator for lock-conditioned mutations."
    },
    {
      "operation": "copy",
      "outcome": "passed",
      "httpStatus": 201,
      "memberStatuses": [],
      "propertyStatuses": []
    },
    {
      "operation": "copy-no-overwrite",
      "outcome": "passed",
      "httpStatus": 412,
      "detail": "Expected HTTP 412"
    },
    {
      "operation": "move",
      "outcome": "passed",
      "httpStatus": 201,
      "memberStatuses": [],
      "propertyStatuses": []
    },
    {
      "operation": "sync-discovery",
      "outcome": "unavailable-property",
      "httpStatus": 207,
      "memberStatuses": [],
      "propertyStatuses": [
        404
      ],
      "detail": "404 property means discovery property unavailable, NOT proof REPORT is unsupported."
    },
    {
      "operation": "sync-report",
      "outcome": "unsupported",
      "httpStatus": 501,
      "memberStatuses": [],
      "propertyStatuses": []
    },
    {
      "operation": "delete-file",
      "outcome": "passed",
      "httpStatus": 204,
      "memberStatuses": [],
      "propertyStatuses": []
    },
    {
      "operation": "cleanup-tree",
      "outcome": "passed",
      "httpStatus": 204,
      "memberStatuses": [],
      "propertyStatuses": [],
      "detail": "Only confirmed run-owned tree deleted; absence verified."
    }
  ],
  "succeeded": false
}
