{
  "schemaVersion": 1,
  "suiteVersion": "1.1",
  "startedUtc": "2026-10-21T15:25:44.3547662+00:00",
  "runtime": ".NET 10.0.13",
  "operatingSystem": "Microsoft Windows 10.0.26300",
  "architecture": "X64",
  "server": "nginx",
  "serverVersion": "1.28.0",
  "serverVersionSource": "fixture-pin-or-operator-label",
  "authentication": "anonymous",
  "transport": "http",
  "loopback": true,
  "sourceRevision": "b3e2e5e80e38876767ac9e82c3a9bdca01e4e5b4",
  "sourceRevisionScope": "repository revision at execution; result-only commit may follow",
  "runTree": "webdavclient-interop-37a1dcf60b9d4a7d990c6b638bc2bca1",
  "advertisedDav": [],
  "advertisedMethods": [],
  "advertisedReports": [],
  "observations": [
    {
      "operation": "options",
      "outcome": "unsupported",
      "httpStatus": 405,
      "memberStatuses": [],
      "propertyStatuses": []
    },
    {
      "operation": "isolation-preflight",
      "outcome": "passed",
      "httpStatus": 404,
      "detail": "Expected HTTP 404"
    },
    {
      "operation": "create-tree",
      "outcome": "passed",
      "httpStatus": 201,
      "memberStatuses": [],
      "propertyStatuses": []
    },
    {
      "operation": "unicode-put",
      "outcome": "passed",
      "httpStatus": 201,
      "memberStatuses": [],
      "propertyStatuses": []
    },
    {
      "operation": "unicode-get",
      "outcome": "passed",
      "httpStatus": 200,
      "detail": "Byte-for-byte body and range metadata checked."
    },
    {
      "operation": "head-metadata",
      "outcome": "passed",
      "httpStatus": 200,
      "memberStatuses": [],
      "propertyStatuses": []
    },
    {
      "operation": "range-get",
      "outcome": "passed",
      "httpStatus": 206,
      "detail": "Byte-for-byte body and range metadata checked."
    },
    {
      "operation": "conditional-create",
      "outcome": "passed",
      "httpStatus": 201,
      "detail": "Run-owned create-if-absent, exact bytes and a strong validator checked."
    },
    {
      "operation": "conditional-put",
      "outcome": "failed",
      "httpStatus": 204,
      "detail": "Expected HTTP 412"
    },
    {
      "operation": "conditional-integrity",
      "outcome": "failed",
      "httpStatus": 200,
      "detail": "Byte-for-byte body and range metadata checked."
    },
    {
      "operation": "conditional-etag-create",
      "outcome": "passed",
      "httpStatus": 201,
      "detail": "Run-owned create-if-absent, exact bytes and a strong validator checked."
    },
    {
      "operation": "conditional-if-match",
      "outcome": "passed",
      "httpStatus": 204,
      "memberStatuses": [],
      "propertyStatuses": []
    },
    {
      "operation": "conditional-if-match-integrity",
      "outcome": "passed",
      "httpStatus": 200,
      "detail": "Replacement bytes and a changed strong validator checked."
    },
    {
      "operation": "conditional-stale-put",
      "outcome": "failed",
      "httpStatus": 204,
      "detail": "Expected HTTP 412"
    },
    {
      "operation": "conditional-stale-integrity",
      "outcome": "failed",
      "httpStatus": 200,
      "detail": "Byte-for-byte body and range metadata checked."
    },
    {
      "operation": "propfind-statuses",
      "outcome": "unsupported",
      "httpStatus": 405,
      "memberStatuses": [],
      "propertyStatuses": []
    },
    {
      "operation": "streamed-listing",
      "outcome": "unsupported",
      "httpStatus": 405,
      "memberStatuses": [],
      "propertyStatuses": []
    },
    {
      "operation": "dead-property",
      "outcome": "unsupported",
      "httpStatus": 405,
      "memberStatuses": [],
      "propertyStatuses": [],
      "detail": ""
    },
    {
      "operation": "lock-unlock",
      "outcome": "unsupported",
      "httpStatus": 405,
      "memberStatuses": [],
      "propertyStatuses": []
    },
    {
      "operation": "lock-put-create",
      "outcome": "passed",
      "httpStatus": 201,
      "detail": "Run-owned create-if-absent, exact bytes and a strong validator checked."
    },
    {
      "operation": "lock-put-acquire",
      "outcome": "unsupported",
      "httpStatus": 405,
      "memberStatuses": [],
      "propertyStatuses": [],
      "detail": "LOCK not confirmed; dependent token-conditioned mutations were not executed."
    },
    {
      "operation": "copy",
      "outcome": "passed",
      "httpStatus": 204,
      "memberStatuses": [],
      "propertyStatuses": []
    },
    {
      "operation": "copy-no-overwrite",
      "outcome": "passed",
      "httpStatus": 412,
      "detail": "Expected HTTP 412"
    },
    {
      "operation": "move",
      "outcome": "passed",
      "httpStatus": 204,
      "memberStatuses": [],
      "propertyStatuses": []
    },
    {
      "operation": "sync-discovery",
      "outcome": "unsupported",
      "httpStatus": 405,
      "memberStatuses": [],
      "propertyStatuses": []
    },
    {
      "operation": "sync-report",
      "outcome": "unsupported",
      "httpStatus": 405,
      "memberStatuses": [],
      "propertyStatuses": []
    },
    {
      "operation": "delete-file",
      "outcome": "passed",
      "httpStatus": 204,
      "memberStatuses": [],
      "propertyStatuses": []
    },
    {
      "operation": "cleanup-tree",
      "outcome": "passed",
      "httpStatus": 204,
      "memberStatuses": [],
      "propertyStatuses": [],
      "detail": "Only confirmed run-owned tree deleted; absence verified."
    }
  ],
  "succeeded": false
}
