{
  "schemaVersion": 1,
  "suiteVersion": "1.0",
  "startedUtc": "2026-10-20T22:35:01.6635993+00:00",
  "runtime": ".NET 10.0.13",
  "operatingSystem": "Ubuntu 24.04.5 LTS",
  "architecture": "X64",
  "server": "sabredav",
  "serverVersion": "4.7.0\u002Bphp-8.3.25",
  "serverVersionSource": "fixture-pin-or-operator-label",
  "authentication": "basic",
  "transport": "http",
  "loopback": true,
  "sourceRevision": "b3622814f7e2cdef587353b678bcd14b70446768",
  "sourceRevisionScope": "repository revision at execution; result-only commit may follow",
  "runTree": "webdavclient-interop-bd4c7cde04ef4db19496f7967c4dd53a",
  "advertisedDav": [
    "1",
    "3",
    "extended-mkcol",
    "2"
  ],
  "advertisedMethods": [
    "OPTIONS",
    "GET",
    "HEAD",
    "DELETE",
    "PROPFIND",
    "PUT",
    "PROPPATCH",
    "COPY",
    "MOVE",
    "REPORT",
    "LOCK",
    "UNLOCK"
  ],
  "advertisedReports": [],
  "observations": [
    {
      "operation": "options",
      "outcome": "passed",
      "httpStatus": 200,
      "memberStatuses": [],
      "propertyStatuses": []
    },
    {
      "operation": "isolation-preflight",
      "outcome": "passed",
      "httpStatus": 404,
      "detail": "Expected HTTP 404"
    },
    {
      "operation": "create-tree",
      "outcome": "passed",
      "httpStatus": 201,
      "memberStatuses": [],
      "propertyStatuses": []
    },
    {
      "operation": "unicode-put",
      "outcome": "passed",
      "httpStatus": 201,
      "memberStatuses": [],
      "propertyStatuses": []
    },
    {
      "operation": "authentication-boundary",
      "outcome": "passed",
      "httpStatus": 401,
      "detail": "Unauthenticated HEAD must be 401 with the configured authentication scheme; no bad-password attempts."
    },
    {
      "operation": "unicode-get",
      "outcome": "passed",
      "httpStatus": 200,
      "detail": "Byte-for-byte body and range metadata checked."
    },
    {
      "operation": "head-metadata",
      "outcome": "passed",
      "httpStatus": 200,
      "memberStatuses": [],
      "propertyStatuses": []
    },
    {
      "operation": "range-get",
      "outcome": "passed",
      "httpStatus": 206,
      "detail": "Byte-for-byte body and range metadata checked."
    },
    {
      "operation": "conditional-put",
      "outcome": "passed",
      "httpStatus": 412,
      "detail": "Expected HTTP 412"
    },
    {
      "operation": "conditional-integrity",
      "outcome": "passed",
      "httpStatus": 200,
      "detail": "Byte-for-byte body and range metadata checked."
    },
    {
      "operation": "propfind-statuses",
      "outcome": "passed",
      "httpStatus": 207,
      "memberStatuses": [],
      "propertyStatuses": [
        200,
        404
      ],
      "detail": "Requested missing property must be 404 beside valid content length."
    },
    {
      "operation": "streamed-listing",
      "outcome": "passed",
      "httpStatus": 207,
      "memberStatuses": [],
      "propertyStatuses": [
        200,
        200
      ],
      "detail": "Full enumeration, document completion, member/property success, and Unicode child href checked."
    },
    {
      "operation": "dead-property",
      "outcome": "failed",
      "httpStatus": 207,
      "detail": "proppatch:WebDAVException"
    },
    {
      "operation": "lock-unlock",
      "outcome": "failed",
      "httpStatus": 200,
      "detail": "WebDAVException:XmlException"
    },
    {
      "operation": "copy",
      "outcome": "passed",
      "httpStatus": 201,
      "memberStatuses": [],
      "propertyStatuses": []
    },
    {
      "operation": "copy-no-overwrite",
      "outcome": "passed",
      "httpStatus": 412,
      "detail": "Expected HTTP 412"
    },
    {
      "operation": "move",
      "outcome": "passed",
      "httpStatus": 201,
      "memberStatuses": [],
      "propertyStatuses": []
    },
    {
      "operation": "sync-discovery",
      "outcome": "passed",
      "httpStatus": 207,
      "memberStatuses": [],
      "propertyStatuses": [
        200
      ],
      "detail": "404 property means discovery property unavailable, NOT proof REPORT is unsupported."
    },
    {
      "operation": "sync-report",
      "outcome": "failed",
      "httpStatus": 415,
      "memberStatuses": [],
      "propertyStatuses": []
    },
    {
      "operation": "delete-file",
      "outcome": "failed",
      "httpStatus": 423,
      "memberStatuses": [],
      "propertyStatuses": []
    },
    {
      "operation": "cleanup-tree",
      "outcome": "failed",
      "httpStatus": 423,
      "memberStatuses": [],
      "propertyStatuses": [],
      "detail": "Only confirmed run-owned tree deleted; absence verified."
    }
  ],
  "succeeded": false
}
